,Series_Title,Genre,Overview,Director,Star1,Star2,Star3,Star4,combined_cols
761,Toki o kakeru shôjo,"Animation, Adventure, Comedy","A high-school girl named Makoto acquires the power to travel back in time, and decides to use it for her own personal benefits. Little does she know that she is affecting the lives of others just as much as she is her own.",Mamoru Hosoda,Riisa Naka,Takuya Ishida,Mitsutaka Itakura,Ayami Kakiuchi,toki kakeru sh jo animation adventure comedy high school girl named makoto acquires power travel back time decides use personal benefits little know affecting lives others much mamoru hosoda riisa naka takuya ishida mitsutaka itakura ayami kakiuchi
762,Death Note: Desu nôto,"Crime, Drama, Fantasy","A battle between the world's two greatest minds begins when Light Yagami finds the Death Note, a notebook with the power to kill, and decides to rid the world of criminals.",Shûsuke Kaneko,Tatsuya Fujiwara,Ken'ichi Matsuyama,Asaka Seto,Yû Kashii,death note desu n crime drama fantasy battle world two greatest minds begins light yagami finds death note notebook power kill decides rid world criminals sh suke kaneko tatsuya fujiwara ken ichi matsuyama asaka seto kashii
763,This Is England,"Crime, Drama","A young boy becomes friends with a gang of skinheads. Friends soon become like family, and relationships will be pushed to the very limit.",Shane Meadows,Thomas Turgoose,Stephen Graham,Jo Hartley,Andrew Shim,england crime drama young boy becomes friends gang skinheads friends soon become like family relationships pushed limit shane meadows thomas turgoose stephen graham jo hartley andrew shim
764,Ex Machina,"Drama, Sci-Fi, Thriller",A young programmer is selected to participate in a ground-breaking experiment in synthetic intelligence by evaluating the human qualities of a highly advanced humanoid A.I.,Alex Garland,Alicia Vikander,Domhnall Gleeson,Oscar Isaac,Sonoya Mizuno,ex machina drama sci fi thriller young programmer selected participate ground breaking experiment synthetic intelligence evaluating human qualities highly advanced humanoid alex garland alicia vikander domhnall gleeson oscar isaac sonoya mizuno
765,Efter brylluppet,Drama,"A manager of an orphanage in India is sent to Copenhagen, Denmark, where he discovers a life-altering family secret.",Susanne Bier,Mads Mikkelsen,Sidse Babett Knudsen,Rolf Lassgård,Neeral Mulchandani,efter brylluppet drama manager orphanage india sent copenhagen denmark discovers life altering family secret susanne bier mads mikkelsen sidse babett knudsen rolf lassg rd neeral mulchandani
766,The Last King of Scotland,"Biography, Drama, History",Based on the events of the brutal Ugandan dictator Idi Amin's regime as seen by his personal physician during the 1970s.,Kevin Macdonald,James McAvoy,Forest Whitaker,Gillian Anderson,Kerry Washington,last king scotland biography drama history based events brutal ugandan dictator idi amin regime seen personal physician 1970s kevin macdonald james mcavoy forest whitaker gillian anderson kerry washington
767,Zodiac,"Crime, Drama, Mystery","In the late 1960s/early 1970s, a San Francisco cartoonist becomes an amateur detective obsessed with tracking down the Zodiac Killer, an unidentified individual who terrorizes Northern California with a killing spree.",David Fincher,Jake Gyllenhaal,Robert Downey Jr.,Mark Ruffalo,Anthony Edwards,zodiac crime drama mystery late 1960s early 1970s san francisco cartoonist becomes amateur detective obsessed tracking zodiac killer unidentified individual terrorizes northern california killing spree david fincher jake gyllenhaal robert downey jr mark ruffalo anthony edwards
768,Lucky Number Slevin,"Action, Crime, Drama","A case of mistaken identity lands Slevin into the middle of a war being plotted by two of the city's most rival crime bosses. Under constant surveillance by Detective Brikowski and assassin Goodkat, he must get them before they get him.",Paul McGuigan,Josh Hartnett,Ben Kingsley,Morgan Freeman,Lucy Liu,lucky number slevin action crime drama case mistaken identity lands slevin middle war plotted two city rival crime bosses constant surveillance detective brikowski assassin goodkat must get get paul mcguigan josh hartnett ben kingsley morgan freeman lucy liu
769,Joyeux Noël,"Drama, History, Music","In December 1914, an unofficial Christmas truce on the Western Front allows soldiers from opposing sides of the First World War to gain insight into each other's way of life.",Christian Carion,Diane Kruger,Benno Fürmann,Guillaume Canet,Natalie Dessay,joyeux l drama history music december 1914 unofficial christmas truce western front allows soldiers opposing sides first world war gain insight way life christian carion diane kruger benno f rmann guillaume canet natalie dessay
770,Control,"Biography, Drama, Music","A profile of Ian Curtis, the enigmatic singer of Joy Division whose personal, professional, and romantic troubles led him to commit suicide at the age of 23.",Anton Corbijn,Sam Riley,Samantha Morton,Craig Parkinson,Alexandra Maria Lara,control biography drama music profile ian curtis enigmatic singer joy division whose personal professional romantic troubles led commit suicide age 23 anton corbijn sam riley samantha morton craig parkinson alexandra maria lara
771,Tangled,"Animation, Adventure, Comedy","The magically long-haired Rapunzel has spent her entire life in a tower, but now that a runaway thief has stumbled upon her, she is about to discover the world for the first time, and who she really is.",Nathan Greno,Byron Howard,Mandy Moore,Zachary Levi,Donna Murphy,tangled animation adventure comedy magically long haired rapunzel spent entire life tower runaway thief stumbled upon discover world first time really nathan greno byron howard mandy moore zachary levi donna murphy
772,Zwartboek,"Drama, Thriller, War","In the Nazi-occupied Netherlands during World War II, a Jewish singer infiltrates the regional Gestapo headquarters for the Dutch resistance.",Paul Verhoeven,Carice van Houten,Sebastian Koch,Thom Hoffman,Halina Reijn,zwartboek drama thriller war nazi occupied netherlands world war ii jewish singer infiltrates regional gestapo headquarters dutch resistance paul verhoeven carice van houten sebastian koch thom hoffman halina reijn
773,Brokeback Mountain,"Drama, Romance","The story of a forbidden and secretive relationship between two cowboys, and their lives over the years.",Ang Lee,Jake Gyllenhaal,Heath Ledger,Michelle Williams,Randy Quaid,brokeback mountain drama romance story forbidden secretive relationship two cowboys lives years ang lee jake gyllenhaal heath ledger michelle williams randy quaid
774,3:10 to Yuma,"Action, Crime, Drama",A small-time rancher agrees to hold a captured outlaw who's awaiting a train to go to court in Yuma. A battle of wills ensues as the outlaw tries to psych out the rancher.,James Mangold,Russell Crowe,Christian Bale,Ben Foster,Logan Lerman,3 10 yuma action crime drama small time rancher agrees hold captured outlaw awaiting train go court yuma battle wills ensues outlaw tries psych rancher james mangold russell crowe christian bale ben foster logan lerman
775,Crash,"Crime, Drama, Thriller","Los Angeles citizens with vastly separate lives collide in interweaving stories of race, loss and redemption.",Paul Haggis,Don Cheadle,Sandra Bullock,Thandie Newton,Karina Arroyave,crash crime drama thriller los angeles citizens vastly separate lives collide interweaving stories race loss redemption paul haggis cheadle sandra bullock thandie newton karina arroyave
776,Kung fu,"Action, Comedy, Fantasy","In Shanghai, China in the 1940s, a wannabe gangster aspires to join the notorious ""Axe Gang"" while residents of a housing complex exhibit extraordinary powers in defending their turf.",Stephen Chow,Stephen Chow,Wah Yuen,Qiu Yuen,Siu-Lung Leung,kung fu action comedy fantasy shanghai china 1940s wannabe gangster aspires join notorious axe gang residents housing complex exhibit extraordinary powers defending turf stephen chow stephen chow wah yuen qiu yuen siu lung leung
777,The Bourne Supremacy,"Action, Mystery, Thriller","When Jason Bourne is framed for a CIA operation gone awry, he is forced to resume his former life as a trained assassin to survive.",Paul Greengrass,Matt Damon,Franka Potente,Joan Allen,Brian Cox,bourne supremacy action mystery thriller jason bourne framed cia operation gone awry forced resume former life trained assassin survive paul greengrass matt damon franka potente joan allen brian cox
778,The Machinist,"Drama, Thriller",An industrial worker who hasn't slept in a year begins to doubt his own sanity.,Brad Anderson,Christian Bale,Jennifer Jason Leigh,Aitana Sánchez-Gijón,John Sharian,machinist drama thriller industrial worker slept year begins doubt sanity brad anderson christian bale jennifer jason leigh aitana nchez gij n john sharian
779,Ray,"Biography, Drama, Music","The story of the life and career of the legendary rhythm and blues musician Ray Charles, from his humble beginnings in the South, where he went blind at age seven, to his meteoric rise to stardom during the 1950s and 1960s.",Taylor Hackford,Jamie Foxx,Regina King,Kerry Washington,Clifton Powell,ray biography drama music story life career legendary rhythm blues musician ray charles humble beginnings south went blind age seven meteoric rise stardom 1950s 1960s taylor hackford jamie foxx regina king kerry washington clifton powell
780,Lost in Translation,"Comedy, Drama",A faded movie star and a neglected young woman form an unlikely bond after crossing paths in Tokyo.,Sofia Coppola,Bill Murray,Scarlett Johansson,Giovanni Ribisi,Anna Faris,lost translation comedy drama faded movie star neglected young woman form unlikely bond crossing paths tokyo sofia coppola bill murray scarlett johansson giovanni ribisi anna faris
781,Harry Potter and the Goblet of Fire,"Adventure, Family, Fantasy","Harry Potter finds himself competing in a hazardous tournament between rival schools of magic, but he is distracted by recurring nightmares.",Mike Newell,Daniel Radcliffe,Emma Watson,Rupert Grint,Eric Sykes,harry potter goblet fire adventure family fantasy harry potter finds competing hazardous tournament rival schools magic distracted recurring nightmares mike newell daniel radcliffe emma watson rupert grint eric sykes
782,Man on Fire,"Action, Crime, Drama","In Mexico City, a former CIA operative swears vengeance on those who committed an unspeakable act against the family he was hired to protect.",Tony Scott,Denzel Washington,Christopher Walken,Dakota Fanning,Radha Mitchell,man fire action crime drama mexico city former cia operative swears vengeance committed unspeakable act family hired protect tony scott denzel washington christopher walken dakota fanning radha mitchell
783,Coraline,"Animation, Drama, Family","An adventurous 11-year-old girl finds another world that is a strangely idealized version of her frustrating home, but it has sinister secrets.",Henry Selick,Dakota Fanning,Teri Hatcher,John Hodgman,Jennifer Saunders,coraline animation drama family adventurous 11 year old girl finds another world strangely idealized version frustrating home sinister secrets henry selick dakota fanning teri hatcher john hodgman jennifer saunders
784,The Last Samurai,"Action, Drama",An American military advisor embraces the Samurai culture he was hired to destroy after he is captured in battle.,Edward Zwick,Tom Cruise,Ken Watanabe,Billy Connolly,William Atherton,last samurai action drama american military advisor embraces samurai culture hired destroy captured battle edward zwick tom cruise ken watanabe billy connolly william atherton
785,The Magdalene Sisters,Drama,Three young Irish women struggle to maintain their spirits while they endure dehumanizing abuse as inmates of a Magdalene Sisters Asylum.,Peter Mullan,Eileen Walsh,Dorothy Duffy,Nora-Jane Noone,Anne-Marie Duff,magdalene sisters drama three young irish women struggle maintain spirits endure dehumanizing abuse inmates magdalene sisters asylum peter mullan eileen walsh dorothy duffy nora jane noone anne marie duff
786,Good Bye Lenin!,"Comedy, Drama, Romance","In 1990, to protect his fragile mother from a fatal shock after a long coma, a young man must keep her from learning that her beloved nation of East Germany as she knew it has disappeared.",Wolfgang Becker,Daniel Brühl,Katrin Saß,Chulpan Khamatova,Florian Lukas,good bye lenin comedy drama romance 1990 protect fragile mother fatal shock long coma young man must keep learning beloved nation east germany knew disappeared wolfgang becker daniel br hl katrin sa chulpan khamatova florian lukas
787,In America,Drama,A family of Irish immigrants adjust to life on the mean streets of Hell's Kitchen while also grieving the death of a child.,Jim Sheridan,Paddy Considine,Samantha Morton,Djimon Hounsou,Sarah Bolger,america drama family irish immigrants adjust life mean streets hell kitchen also grieving death child jim sheridan paddy considine samantha morton djimon hounsou sarah bolger
788,I Am Sam,Drama,A mentally handicapped man fights for custody of his 7-year-old daughter and in the process teaches his cold-hearted lawyer the value of love and family.,Jessie Nelson,Sean Penn,Michelle Pfeiffer,Dakota Fanning,Dianne Wiest,sam drama mentally handicapped man fights custody 7 year old daughter process teaches cold hearted lawyer value love family jessie nelson sean penn michelle pfeiffer dakota fanning dianne wiest
789,Adaptation.,"Comedy, Drama",A lovelorn screenwriter becomes desperate as he tries and fails to adapt 'The Orchid Thief' by Susan Orlean for the screen.,Spike Jonze,Nicolas Cage,Meryl Streep,Chris Cooper,Tilda Swinton,adaptation comedy drama lovelorn screenwriter becomes desperate tries fails adapt orchid thief susan orlean screen spike jonze nicolas cage meryl streep chris cooper tilda swinton
790,Black Hawk Down,"Drama, History, War",160 elite U.S. soldiers drop into Somalia to capture two top lieutenants of a renegade warlord and find themselves in a desperate battle with a large force of heavily-armed Somalis.,Ridley Scott,Josh Hartnett,Ewan McGregor,Tom Sizemore,Eric Bana,black hawk drama history war 160 elite u soldiers drop somalia capture two top lieutenants renegade warlord find desperate battle large force heavily armed somalis ridley scott josh hartnett ewan mcgregor tom sizemore eric bana
791,Road to Perdition,"Crime, Drama, Thriller","A mob enforcer's son witnesses a murder, forcing him and his father to take to the road, and his father down a path of redemption and revenge.",Sam Mendes,Tom Hanks,Tyler Hoechlin,Rob Maxey,Liam Aiken,road perdition crime drama thriller mob enforcer son witnesses murder forcing father take road father path redemption revenge sam mendes tom hanks tyler hoechlin rob maxey liam aiken
792,Das Experiment,"Drama, Thriller","For two weeks, 20 male participants are hired to play prisoners and guards in a prison. The ""prisoners"" have to follow seemingly mild rules, and the ""guards"" are told to retain order without using physical violence.",Oliver Hirschbiegel,Moritz Bleibtreu,Christian Berkel,Oliver Stokowski,Wotan Wilke Möhring,das experiment drama thriller two weeks 20 male participants hired play prisoners guards prison prisoners follow seemingly mild rules guards told retain order without using physical violence oliver hirschbiegel moritz bleibtreu christian berkel oliver stokowski wotan wilke hring
793,Billy Elliot,"Drama, Music",A talented young boy becomes torn between his unexpected love of dance and the disintegration of his family.,Stephen Daldry,Jamie Bell,Julie Walters,Jean Heywood,Jamie Draven,billy elliot drama music talented young boy becomes torn unexpected love dance disintegration family stephen daldry jamie bell julie walters jean heywood jamie draven
794,Hedwig and the Angry Inch,"Comedy, Drama, Music",A gender-queer punk-rock singer from East Berlin tours the U.S. with her band as she tells her life story and follows the former lover/band-mate who stole her songs.,John Cameron Mitchell,John Cameron Mitchell,Miriam Shor,Stephen Trask,Theodore Liscinski,hedwig angry inch comedy drama music gender queer punk rock singer east berlin tours u band tells life story follows former lover band mate stole songs john cameron mitchell john cameron mitchell miriam shor stephen trask theodore liscinski
795,Ocean's Eleven,"Crime, Thriller",Danny Ocean and his ten accomplices plan to rob three Las Vegas casinos simultaneously.,Steven Soderbergh,George Clooney,Brad Pitt,Julia Roberts,Matt Damon,ocean eleven crime thriller danny ocean ten accomplices plan rob three las vegas casinos simultaneously steven soderbergh george clooney brad pitt julia roberts matt damon
796,Vampire Hunter D: Bloodlust,"Animation, Action, Fantasy","When a girl is abducted by a vampire, a legendary bounty hunter is hired to bring her back.",Yoshiaki Kawajiri,Andrew Philpot,John Rafter Lee,Pamela Adlon,Wendee Lee,vampire hunter bloodlust animation action fantasy girl abducted vampire legendary bounty hunter hired bring back yoshiaki kawajiri andrew philpot john rafter lee pamela adlon wendee lee
797,"O Brother, Where Art Thou?","Adventure, Comedy, Crime","In the deep south during the 1930s, three escaped convicts search for hidden treasure while a relentless lawman pursues them.",Joel Coen,Ethan Coen,George Clooney,John Turturro,Tim Blake Nelson,brother art thou adventure comedy crime deep south 1930s three escaped convicts search hidden treasure relentless lawman pursues joel coen ethan coen george clooney john turturro tim blake nelson
798,Interstate 60: Episodes of the Road,"Adventure, Comedy, Drama","Neal Oliver, a very confused young man and an artist, takes a journey of a lifetime on a highway I60 that doesn't exist on any of the maps, going to the places he never even heard of, searching for an answer and his dreamgirl.",Bob Gale,James Marsden,Gary Oldman,Kurt Russell,Matthew Edison,interstate 60 episodes road adventure comedy drama neal oliver confused young man artist takes journey lifetime highway i60 exist maps going places never even heard searching answer dreamgirl bob gale james marsden gary oldman kurt russell matthew edison
799,"South Park: Bigger, Longer & Uncut","Animation, Comedy, Fantasy","When Stan Marsh and his friends go see an R-rated movie, they start cursing and their parents think that Canada is to blame.",Trey Parker,Trey Parker,Matt Stone,Mary Kay Bergman,Isaac Hayes,south park bigger longer uncut animation comedy fantasy stan marsh friends go see r rated movie start cursing parents think canada blame trey parker trey parker matt stone mary kay bergman isaac hayes
800,Office Space,Comedy,Three company workers who hate their jobs decide to rebel against their greedy boss.,Mike Judge,Ron Livingston,Jennifer Aniston,David Herman,Ajay Naidu,office space comedy three company workers hate jobs decide rebel greedy boss mike judge ron livingston jennifer aniston david herman ajay naidu
801,Happiness,"Comedy, Drama","The lives of several individuals intertwine as they go about their lives in their own unique ways, engaging in acts society as a whole might find disturbing in a desperate search for human connection.",Todd Solondz,Jane Adams,Jon Lovitz,Philip Seymour Hoffman,Dylan Baker,happiness comedy drama lives several individuals intertwine go lives unique ways engaging acts society whole might find disturbing desperate search human connection todd solondz jane adams jon lovitz philip seymour hoffman dylan baker
802,Training Day,"Crime, Drama, Thriller",A rookie cop spends his first day as a Los Angeles narcotics officer with a rogue detective who isn't what he appears to be.,Antoine Fuqua,Denzel Washington,Ethan Hawke,Scott Glenn,Tom Berenger,training day crime drama thriller rookie cop spends first day los angeles narcotics officer rogue detective appears antoine fuqua denzel washington ethan hawke scott glenn tom berenger
803,Rushmore,"Comedy, Drama, Romance",The extracurricular king of Rushmore Preparatory School is put on academic probation.,Wes Anderson,Jason Schwartzman,Bill Murray,Olivia Williams,Seymour Cassel,rushmore comedy drama romance extracurricular king rushmore preparatory school put academic probation wes anderson jason schwartzman bill murray olivia williams seymour cassel
804,Abre los ojos,"Drama, Mystery, Sci-Fi","A very handsome man finds the love of his life, but he suffers an accident and needs to have his face rebuilt by surgery after it is severely disfigured.",Alejandro Amenábar,Eduardo Noriega,Penélope Cruz,Chete Lera,Fele Martínez,abre los ojos drama mystery sci fi handsome man finds love life suffers accident needs face rebuilt surgery severely disfigured alejandro amen bar eduardo noriega pen lope cruz chete lera fele mart nez
805,Being John Malkovich,"Comedy, Drama, Fantasy",A puppeteer discovers a portal that leads literally into the head of movie star John Malkovich.,Spike Jonze,John Cusack,Cameron Diaz,Catherine Keener,John Malkovich,john malkovich comedy drama fantasy puppeteer discovers portal leads literally head movie star john malkovich spike jonze john cusack cameron diaz catherine keener john malkovich
806,As Good as It Gets,"Comedy, Drama, Romance","A single mother and waitress, a misanthropic author, and a gay artist form an unlikely friendship after the artist is assaulted in a robbery.",James L. Brooks,Jack Nicholson,Helen Hunt,Greg Kinnear,Cuba Gooding Jr.,good gets comedy drama romance single mother waitress misanthropic author gay artist form unlikely friendship artist assaulted robbery james l brooks jack nicholson helen hunt greg kinnear cuba gooding jr
807,The Fifth Element,"Action, Adventure, Sci-Fi","In the colorful future, a cab driver unwittingly becomes the central figure in the search for a legendary cosmic weapon to keep Evil and Mr. Zorg at bay.",Luc Besson,Bruce Willis,Milla Jovovich,Gary Oldman,Ian Holm,fifth element action adventure sci fi colorful future cab driver unwittingly becomes central figure search legendary cosmic weapon keep evil mr zorg bay luc besson bruce willis milla jovovich gary oldman ian holm
808,Le dîner de cons,Comedy,"A few friends have a weekly fools' dinner, where each brings a fool along. Pierre finds a champion fool for next dinner. Surprise.",Francis Veber,Thierry Lhermitte,Jacques Villeret,Francis Huster,Daniel Prévost,le ner de cons comedy friends weekly fools dinner brings fool along pierre finds champion fool next dinner surprise francis veber thierry lhermitte jacques villeret francis huster daniel pr vost
809,Donnie Brasco,"Biography, Crime, Drama","An FBI undercover agent infiltrates the mob and finds himself identifying more with the mafia life, at the expense of his regular one.",Mike Newell,Al Pacino,Johnny Depp,Michael Madsen,Bruno Kirby,donnie brasco biography crime drama fbi undercover agent infiltrates mob finds identifying mafia life expense regular one mike newell al pacino johnny depp michael madsen bruno kirby
810,Shine,"Biography, Drama, Music","Pianist David Helfgott, driven by his father and teachers, has a breakdown. Years later he returns to the piano, to popular if not critical acclaim.",Scott Hicks,Geoffrey Rush,Armin Mueller-Stahl,Justin Braine,Sonia Todd,shine biography drama music pianist david helfgott driven father teachers breakdown years later returns piano popular critical acclaim scott hicks geoffrey rush armin mueller stahl justin braine sonia todd
811,Primal Fear,"Crime, Drama, Mystery","An altar boy is accused of murdering a priest, and the truth is buried several layers deep.",Gregory Hoblit,Richard Gere,Laura Linney,Edward Norton,John Mahoney,primal fear crime drama mystery altar boy accused murdering priest truth buried several layers deep gregory hoblit richard gere laura linney edward norton john mahoney
812,Hamlet,Drama,"Hamlet, Prince of Denmark, returns home to find his father murdered and his mother remarrying the murderer, his uncle. Meanwhile, war is brewing.",Kenneth Branagh,Kenneth Branagh,Julie Christie,Derek Jacobi,Kate Winslet,hamlet drama hamlet prince denmark returns home find father murdered mother remarrying murderer uncle meanwhile war brewing kenneth branagh kenneth branagh julie christie derek jacobi kate winslet
813,A Little Princess,"Drama, Family, Fantasy",A young girl is relegated to servitude at a boarding school when her father goes missing and is presumed dead.,Alfonso Cuarón,Liesel Matthews,Eleanor Bron,Liam Cunningham,Rusty Schwimmer,little princess drama family fantasy young girl relegated servitude boarding school father goes missing presumed dead alfonso cuar n liesel matthews eleanor bron liam cunningham rusty schwimmer
814,Do lok tin si,"Comedy, Crime, Drama","This Hong Kong-set crime drama follows the lives of a hitman, hoping to get out of the business, and his elusive female partner.",Kar-Wai Wong,Leon Lai,Michelle Reis,Takeshi Kaneshiro,Charlie Yeung,lok tin si comedy crime drama hong kong set crime drama follows lives hitman hoping get business elusive female partner kar wai wong leon lai michelle reis takeshi kaneshiro charlie yeung
815,Il postino,"Biography, Comedy, Drama","A simple Italian postman learns to love poetry while delivering mail to a famous poet, and then uses this to woo local beauty Beatrice.",Michael Radford,Massimo Troisi,Massimo Troisi,Philippe Noiret,Maria Grazia Cucinotta,il postino biography comedy drama simple italian postman learns love poetry delivering mail famous poet uses woo local beauty beatrice michael radford massimo troisi massimo troisi philippe noiret maria grazia cucinotta
