,Series_Title,Genre,Overview,Director,Star1,Star2,Star3,Star4,combined_cols
494,In Bruges,"Comedy, Crime, Drama","Guilt-stricken after a job gone wrong, hitman Ray and his partner await orders from their ruthless boss in Bruges, Belgium, the last place in the world Ray wants to be.",Martin McDonagh,Colin Farrell,Brendan Gleeson,Ciarán Hinds,Elizabeth Berrington,bruges comedy crime drama guilt stricken job gone wrong hitman ray partner await orders ruthless boss bruges belgium last place world ray wants martin mcdonagh colin farrell brendan gleeson ciar n hinds elizabeth berrington
495,The Man from Earth,"Drama, Fantasy, Mystery",An impromptu goodbye party for Professor John Oldman becomes a mysterious interrogation after the retiring scholar reveals to his colleagues he has a longer and stranger past than they can imagine.,Richard Schenkman,David Lee Smith,Tony Todd,John Billingsley,Ellen Crawford,man earth drama fantasy mystery impromptu goodbye party professor john oldman becomes mysterious interrogation retiring scholar reveals colleagues longer stranger past imagine richard schenkman david lee smith tony todd john billingsley ellen crawford
496,Letters from Iwo Jima,"Action, Adventure, Drama","The story of the battle of Iwo Jima between the United States and Imperial Japan during World War II, as told from the perspective of the Japanese who fought it.",Clint Eastwood,Ken Watanabe,Kazunari Ninomiya,Tsuyoshi Ihara,Ryô Kase,letters iwo jima action adventure drama story battle iwo jima united states imperial japan world war ii told perspective japanese fought clint eastwood ken watanabe kazunari ninomiya tsuyoshi ihara ry kase
497,The Fall,"Adventure, Drama, Fantasy","In a hospital on the outskirts of 1920s Los Angeles, an injured stuntman begins to tell a fellow patient, a little girl with a broken arm, a fantastic story of five mythical heroes. Thanks to his fractured state of mind and her vivid imagination, the line between fiction and reality blurs as the tale advances.",Tarsem Singh,Lee Pace,Catinca Untaru,Justine Waddell,Kim Uylenbroek,fall adventure drama fantasy hospital outskirts 1920s los angeles injured stuntman begins tell fellow patient little girl broken arm fantastic story five mythical heroes thanks fractured state mind vivid imagination line fiction reality blurs tale advances tarsem singh lee pace catinca untaru justine waddell kim uylenbroek
498,Life of Pi,"Adventure, Drama, Fantasy","A young man who survives a disaster at sea is hurtled into an epic journey of adventure and discovery. While cast away, he forms an unexpected connection with another survivor: a fearsome Bengal tiger.",Ang Lee,Suraj Sharma,Irrfan Khan,Adil Hussain,Tabu,life pi adventure drama fantasy young man survives disaster sea hurtled epic journey adventure discovery cast away forms unexpected connection another survivor fearsome bengal tiger ang lee suraj sharma irrfan khan adil hussain tabu
499,Fantastic Mr. Fox,"Animation, Adventure, Comedy",An urbane fox cannot resist returning to his farm raiding ways and then must help his community survive the farmers' retaliation.,Wes Anderson,George Clooney,Meryl Streep,Bill Murray,Jason Schwartzman,fantastic mr fox animation adventure comedy urbane fox resist returning farm raiding ways must help community survive farmers retaliation wes anderson george clooney meryl streep bill murray jason schwartzman
500,C.R.A.Z.Y.,"Comedy, Drama","A young French-Canadian, growing up in the 1960s and 1970s, struggles to reconcile his emerging homosexuality with his father's conservative values and his own Catholic beliefs.",Jean-Marc Vallée,Michel Côté,Marc-André Grondin,Danielle Proulx,Émile Vallée,c r z comedy drama young french canadian growing 1960s 1970s struggles reconcile emerging homosexuality father conservative values catholic beliefs jean marc vall e michel c marc andr grondin danielle proulx mile vall e
501,Les choristes,"Drama, Music",The new teacher at a severely administered boys' boarding school works to positively affect the students' lives through music.,Christophe Barratier,Gérard Jugnot,François Berléand,Jean-Baptiste Maunier,Kad Merad,les choristes drama music new teacher severely administered boys boarding school works positively affect students lives music christophe barratier g rard jugnot fran ois berl jean baptiste maunier kad merad
502,Iron Man,"Action, Adventure, Sci-Fi","After being held captive in an Afghan cave, billionaire engineer Tony Stark creates a unique weaponized suit of armor to fight evil.",Jon Favreau,Robert Downey Jr.,Gwyneth Paltrow,Terrence Howard,Jeff Bridges,iron man action adventure sci fi held captive afghan cave billionaire engineer tony stark creates unique weaponized suit armor fight evil jon favreau robert downey jr gwyneth paltrow terrence howard jeff bridges
503,Shaun of the Dead,"Comedy, Horror",A man's uneventful life is disrupted by the zombie apocalypse.,Edgar Wright,Simon Pegg,Nick Frost,Kate Ashfield,Lucy Davis,shaun dead comedy horror man uneventful life disrupted zombie apocalypse edgar wright simon pegg nick frost kate ashfield lucy davis
504,Gegen die Wand,"Drama, Romance","With the intention to break free from the strict familial restrictions, a suicidal young woman sets up a marriage of convenience with a forty-year-old addict, an act that will lead to an outburst of envious love.",Fatih Akin,Birol Ünel,Sibel Kekilli,Güven Kiraç,Zarah Jane McKenzie,gegen die wand drama romance intention break free strict familial restrictions suicidal young woman sets marriage convenience forty year old addict act lead outburst envious love fatih akin birol nel sibel kekilli g ven kira zarah jane mckenzie
505,Mystic River,"Crime, Drama, Mystery",The lives of three men who were childhood friends are shattered when one of them has a family tragedy.,Clint Eastwood,Sean Penn,Tim Robbins,Kevin Bacon,Emmy Rossum,mystic river crime drama mystery lives three men childhood friends shattered one family tragedy clint eastwood sean penn tim robbins kevin bacon emmy rossum
506,Harry Potter and the Prisoner of Azkaban,"Adventure, Family, Fantasy","Harry Potter, Ron and Hermione return to Hogwarts School of Witchcraft and Wizardry for their third year of study, where they delve into the mystery surrounding an escaped prisoner who poses a dangerous threat to the young wizard.",Alfonso Cuarón,Daniel Radcliffe,Emma Watson,Rupert Grint,Richard Griffiths,harry potter prisoner azkaban adventure family fantasy harry potter ron hermione return hogwarts school witchcraft wizardry third year study delve mystery surrounding escaped prisoner poses dangerous threat young wizard alfonso cuar n daniel radcliffe emma watson rupert grint richard griffiths
507,Ying xiong,"Action, Adventure, History","A defense officer, Nameless, was summoned by the King of Qin regarding his success of terminating three warriors.",Yimou Zhang,Jet Li,Tony Chiu-Wai Leung,Maggie Cheung,Ziyi Zhang,ying xiong action adventure history defense officer nameless summoned king qin regarding success terminating three warriors yimou zhang jet li tony chiu wai leung maggie cheung ziyi zhang
508,Hable con ella,"Drama, Mystery, Romance",Two men share an odd friendship while they care for two women who are both in deep comas.,Pedro Almodóvar,Rosario Flores,Javier Cámara,Darío Grandinetti,Leonor Watling,hable con ella drama mystery romance two men share odd friendship care two women deep comas pedro almod var rosario flores javier c mara dar grandinetti leonor watling
509,No Man's Land,"Comedy, Drama, War","Bosnia and Herzegovina during 1993 at the time of the heaviest fighting between the two warring sides. Two soldiers from opposing sides in the conflict, Nino and Ciki, become trapped in no man's land, whilst a third soldier becomes a living booby trap.",Danis Tanovic,Branko Djuric,Rene Bitorajac,Filip Sovagovic,Georges Siatidis,man land comedy drama war bosnia herzegovina 1993 time heaviest fighting two warring sides two soldiers opposing sides conflict nino ciki become trapped man land whilst third soldier becomes living booby trap danis tanovic branko djuric rene bitorajac filip sovagovic georges siatidis
510,Cowboy Bebop: Tengoku no tobira,"Animation, Action, Crime","A terrorist explosion releases a deadly virus on the masses, and it's up the bounty-hunting Bebop crew to catch the cold-blooded culprit.",Shin'ichirô Watanabe,Tensai Okamura,Hiroyuki Okiura,Yoshiyuki Takei,Beau Billingslea,cowboy bebop tengoku tobira animation action crime terrorist explosion releases deadly virus masses bounty hunting bebop crew catch cold blooded culprit shin ichir watanabe tensai okamura hiroyuki okiura yoshiyuki takei beau billingslea
511,The Bourne Identity,"Action, Mystery, Thriller","A man is picked up by a fishing boat, bullet-riddled and suffering from amnesia, before racing to elude assassins and attempting to regain his memory.",Doug Liman,Franka Potente,Matt Damon,Chris Cooper,Clive Owen,bourne identity action mystery thriller man picked fishing boat bullet riddled suffering amnesia racing elude assassins attempting regain memory doug liman franka potente matt damon chris cooper clive owen
512,Nueve reinas,"Crime, Drama, Thriller","Two con artists try to swindle a stamp collector by selling him a sheet of counterfeit rare stamps (the ""nine queens"").",Fabián Bielinsky,Ricardo Darín,Gastón Pauls,Graciela Tenenbaum,María Mercedes Villagra,nueve reinas crime drama thriller two con artists try swindle stamp collector selling sheet counterfeit rare stamps nine queens fabi n bielinsky ricardo dar n gast n pauls graciela tenenbaum mar mercedes villagra
513,Children of Men,"Adventure, Drama, Sci-Fi","In 2027, in a chaotic world in which women have become somehow infertile, a former activist agrees to help transport a miraculously pregnant woman to a sanctuary at sea.",Alfonso Cuarón,Julianne Moore,Clive Owen,Chiwetel Ejiofor,Michael Caine,children men adventure drama sci fi 2027 chaotic world women become somehow infertile former activist agrees help transport miraculously pregnant woman sanctuary sea alfonso cuar n julianne moore clive owen chiwetel ejiofor michael caine
514,Almost Famous,"Adventure, Comedy, Drama",A high-school boy is given the chance to write a story for Rolling Stone Magazine about an up-and-coming rock band as he accompanies them on their concert tour.,Cameron Crowe,Billy Crudup,Patrick Fugit,Kate Hudson,Frances McDormand,almost famous adventure comedy drama high school boy given chance write story rolling stone magazine coming rock band accompanies concert tour cameron crowe billy crudup patrick fugit kate hudson frances mcdormand
515,Mulholland Dr.,"Drama, Mystery, Thriller","After a car wreck on the winding Mulholland Drive renders a woman amnesiac, she and a perky Hollywood-hopeful search for clues and answers across Los Angeles in a twisting venture beyond dreams and reality.",David Lynch,Naomi Watts,Laura Harring,Justin Theroux,Jeanne Bates,mulholland dr drama mystery thriller car wreck winding mulholland drive renders woman amnesiac perky hollywood hopeful search clues answers across los angeles twisting venture beyond dreams reality david lynch naomi watts laura harring justin theroux jeanne bates
516,Toy Story 2,"Animation, Adventure, Comedy","When Woody is stolen by a toy collector, Buzz and his friends set out on a rescue mission to save Woody before he becomes a museum toy property with his roundup gang Jessie, Prospector, and Bullseye.",John Lasseter,Ash Brannon,Lee Unkrich,Tom Hanks,Tim Allen,toy story 2 animation adventure comedy woody stolen toy collector buzz friends set rescue mission save woody becomes museum toy property roundup gang jessie prospector bullseye john lasseter ash brannon lee unkrich tom hanks tim allen
517,Boogie Nights,Drama,"Back when sex was safe, pleasure was a business and business was booming, an idealistic porn producer aspires to elevate his craft to an art when he discovers a hot young talent.",Paul Thomas Anderson,Mark Wahlberg,Julianne Moore,Burt Reynolds,Luis Guzmán,boogie nights drama back sex safe pleasure business business booming idealistic porn producer aspires elevate craft art discovers hot young talent paul thomas anderson mark wahlberg julianne moore burt reynolds luis guzm n
518,Mimi wo sumaseba,"Animation, Drama, Family","A love story between a girl who loves reading books, and a boy who has previously checked out all of the library books she chooses.",Yoshifumi Kondô,Yoko Honna,Issey Takahashi,Takashi Tachibana,Shigeru Muroi,mimi wo sumaseba animation drama family love story girl loves reading books boy previously checked library books chooses yoshifumi kond yoko honna issey takahashi takashi tachibana shigeru muroi
519,Once Were Warriors,"Crime, Drama",A family descended from Maori warriors is bedeviled by a violent father and the societal problems of being treated as outcasts.,Lee Tamahori,Rena Owen,Temuera Morrison,Mamaengaroa Kerr-Bell,Julian Arahanga,warriors crime drama family descended maori warriors bedeviled violent father societal problems treated outcasts lee tamahori rena owen temuera morrison mamaengaroa kerr bell julian arahanga
520,True Romance,"Crime, Drama, Romance","In Detroit, a lonely pop culture geek marries a call girl, steals cocaine from her pimp, and tries to sell it in Hollywood. Meanwhile, the owners of the cocaine, the Mob, track them down in an attempt to reclaim it.",Tony Scott,Christian Slater,Patricia Arquette,Dennis Hopper,Val Kilmer,true romance crime drama romance detroit lonely pop culture geek marries call girl steals cocaine pimp tries sell hollywood meanwhile owners cocaine mob track attempt reclaim tony scott christian slater patricia arquette dennis hopper val kilmer
521,Trois couleurs: Bleu,"Drama, Music, Mystery",A woman struggles to find a way to live her life after the death of her husband and child.,Krzysztof Kieslowski,Juliette Binoche,Zbigniew Zamachowski,Julie Delpy,Benoît Régent,trois couleurs bleu drama music mystery woman struggles find way live life death husband child krzysztof kieslowski juliette binoche zbigniew zamachowski julie delpy beno r gent
522,Jûbê ninpûchô,"Animation, Action, Adventure",A vagabond swordsman is aided by a beautiful ninja girl and a crafty spy in confronting a demonic clan of killers - with a ghost from his past as their leader - who are bent on overthrowing the Tokugawa Shogunate.,Yoshiaki Kawajiri,Kôichi Yamadera,Emi Shinohara,Takeshi Aono,Osamu Saka,j b ninp ch animation action adventure vagabond swordsman aided beautiful ninja girl crafty spy confronting demonic clan killers ghost past leader bent overthrowing tokugawa shogunate yoshiaki kawajiri k ichi yamadera emi shinohara takeshi aono osamu saka
523,Carlito's Way,"Crime, Drama, Thriller","A Puerto Rican former convict, just released from prison, pledges to stay away from drugs and violence despite the pressure around him and lead on to a better life outside of N.Y.C.",Brian De Palma,Al Pacino,Sean Penn,Penelope Ann Miller,John Leguizamo,carlito way crime drama thriller puerto rican former convict released prison pledges stay away drugs violence despite pressure around lead better life outside n c brian de palma al pacino sean penn penelope ann miller john leguizamo
524,Edward Scissorhands,"Drama, Fantasy, Romance","An artificial man, who was incompletely constructed and has scissors for hands, leads a solitary life. Then one day, a suburban lady meets him and introduces him to her world.",Tim Burton,Johnny Depp,Winona Ryder,Dianne Wiest,Anthony Michael Hall,edward scissorhands drama fantasy romance artificial man incompletely constructed scissors hands leads solitary life one day suburban lady meets introduces world tim burton johnny depp winona ryder dianne wiest anthony michael hall
525,My Left Foot: The Story of Christy Brown,"Biography, Drama","Christy Brown, born with cerebral palsy, learns to paint and write with his only controllable limb - his left foot.",Jim Sheridan,Daniel Day-Lewis,Brenda Fricker,Alison Whelan,Kirsten Sheridan,left foot story christy brown biography drama christy brown born cerebral palsy learns paint write controllable limb left foot jim sheridan daniel day lewis brenda fricker alison whelan kirsten sheridan
526,Crimes and Misdemeanors,"Comedy, Drama",An ophthalmologist's mistress threatens to reveal their affair to his wife while a married documentary filmmaker is infatuated with another woman.,Woody Allen,Martin Landau,Woody Allen,Bill Bernstein,Claire Bloom,crimes misdemeanors comedy drama ophthalmologist mistress threatens reveal affair wife married documentary filmmaker infatuated another woman woody allen martin landau woody allen bill bernstein claire bloom
527,The Untouchables,"Crime, Drama, Thriller","During the era of Prohibition in the United States, Federal Agent Eliot Ness sets out to stop ruthless Chicago gangster Al Capone and, because of rampant corruption, assembles a small, hand-picked team to help him.",Brian De Palma,Kevin Costner,Sean Connery,Robert De Niro,Charles Martin Smith,untouchables crime drama thriller era prohibition united states federal agent eliot ness sets stop ruthless chicago gangster al capone rampant corruption assembles small hand picked team help brian de palma kevin costner sean connery robert de niro charles martin smith
528,Hannah and Her Sisters,"Comedy, Drama","Between two Thanksgivings two years apart, Hannah's husband falls in love with her sister Lee, while her hypochondriac ex-husband rekindles his relationship with her sister Holly.",Woody Allen,Mia Farrow,Dianne Wiest,Michael Caine,Barbara Hershey,hannah sisters comedy drama two thanksgivings two years apart hannah husband falls love sister lee hypochondriac ex husband rekindles relationship sister holly woody allen mia farrow dianne wiest michael caine barbara hershey
529,Brazil,"Drama, Sci-Fi",A bureaucrat in a dystopic society becomes an enemy of the state as he pursues the woman of his dreams.,Terry Gilliam,Jonathan Pryce,Kim Greist,Robert De Niro,Katherine Helmond,brazil drama sci fi bureaucrat dystopic society becomes enemy state pursues woman dreams terry gilliam jonathan pryce kim greist robert de niro katherine helmond
530,This Is Spinal Tap,"Comedy, Music","Spinal Tap, one of England's loudest bands, is chronicled by film director Marty DiBergi on what proves to be a fateful tour.",Rob Reiner,Rob Reiner,Michael McKean,Christopher Guest,Kimberly Stringer,spinal tap comedy music spinal tap one england loudest bands chronicled film director marty dibergi proves fateful tour rob reiner rob reiner michael mckean christopher guest kimberly stringer
531,A Christmas Story,"Comedy, Family","In the 1940s, a young boy named Ralphie attempts to convince his parents, his teacher and Santa that a Red Ryder BB gun really is the perfect Christmas gift.",Bob Clark,Peter Billingsley,Melinda Dillon,Darren McGavin,Scott Schwartz,christmas story comedy family 1940s young boy named ralphie attempts convince parents teacher santa red ryder bb gun really perfect christmas gift bob clark peter billingsley melinda dillon darren mcgavin scott schwartz
532,The Blues Brothers,"Action, Adventure, Comedy","Jake Blues, just released from prison, puts together his old band to save the Catholic home where he and his brother Elwood were raised.",John Landis,John Belushi,Dan Aykroyd,Cab Calloway,John Candy,blues brothers action adventure comedy jake blues released prison puts together old band save catholic home brother elwood raised john landis john belushi dan aykroyd cab calloway john candy
533,Manhattan,"Comedy, Drama, Romance",The life of a divorced television writer dating a teenage girl is further complicated when he falls in love with his best friend's mistress.,Woody Allen,Woody Allen,Diane Keaton,Mariel Hemingway,Michael Murphy,manhattan comedy drama romance life divorced television writer dating teenage girl complicated falls love best friend mistress woody allen woody allen diane keaton mariel hemingway michael murphy
534,All That Jazz,"Drama, Music, Musical","Director/choreographer Bob Fosse tells his own life story as he details the sordid career of Joe Gideon, a womanizing, drug-using dancer.",Bob Fosse,Roy Scheider,Jessica Lange,Ann Reinking,Leland Palmer,jazz drama music musical director choreographer bob fosse tells life story details sordid career joe gideon womanizing drug using dancer bob fosse roy scheider jessica lange ann reinking leland palmer
535,Dawn of the Dead,"Action, Adventure, Horror","Following an ever-growing epidemic of zombies that have risen from the dead, two Philadelphia S.W.A.T. team members, a traffic reporter, and his television executive girlfriend seek refuge in a secluded shopping mall.",George A. Romero,David Emge,Ken Foree,Scott H. Reiniger,Gaylen Ross,dawn dead action adventure horror following ever growing epidemic zombies risen dead two philadelphia w team members traffic reporter television executive girlfriend seek refuge secluded shopping mall george romero david emge ken foree scott h reiniger gaylen ross
536,All the President's Men,"Biography, Drama, History","""The Washington Post"" reporters Bob Woodward and Carl Bernstein uncover the details of the Watergate scandal that leads to President Richard Nixon's resignation.",Alan J. Pakula,Dustin Hoffman,Robert Redford,Jack Warden,Martin Balsam,president men biography drama history washington post reporters bob woodward carl bernstein uncover details watergate scandal leads president richard nixon resignation alan j pakula dustin hoffman robert redford jack warden martin balsam
537,La montaña sagrada,"Adventure, Drama, Fantasy","In a corrupt, greed-fueled world, a powerful alchemist leads a messianic character and seven materialistic figures to the Holy Mountain, where they hope to achieve enlightenment.",Alejandro Jodorowsky,Alejandro Jodorowsky,Horacio Salinas,Zamira Saunders,Juan Ferrara,la monta sagrada adventure drama fantasy corrupt greed fueled world powerful alchemist leads messianic character seven materialistic figures holy mountain hope achieve enlightenment alejandro jodorowsky alejandro jodorowsky horacio salinas zamira saunders juan ferrara
538,Amarcord,"Comedy, Drama, Family",A series of comedic and nostalgic vignettes set in a 1930s Italian coastal town.,Federico Fellini,Magali Noël,Bruno Zanin,Pupella Maggio,Armando Brancia,amarcord comedy drama family series comedic nostalgic vignettes set 1930s italian coastal town federico fellini magali l bruno zanin pupella maggio armando brancia
539,Le charme discret de la bourgeoisie,Comedy,"A surreal, virtually plotless series of dreams centered around six middle-class people and their consistently interrupted attempts to have a meal together.",Luis Buñuel,Fernando Rey,Delphine Seyrig,Paul Frankeur,Bulle Ogier,le charme discret de la bourgeoisie comedy surreal virtually plotless series dreams centered around six middle class people consistently interrupted attempts meal together luis bu uel fernando rey delphine seyrig paul frankeur bulle ogier
540,"Aguirre, der Zorn Gottes","Action, Adventure, Biography","In the 16th century, the ruthless and insane Don Lope de Aguirre leads a Spanish expedition in search of El Dorado.",Werner Herzog,Klaus Kinski,Ruy Guerra,Helena Rojo,Del Negro,aguirre der zorn gottes action adventure biography 16th century ruthless insane lope de aguirre leads spanish expedition search el dorado werner herzog klaus kinski ruy guerra helena rojo del negro
541,Harold and Maude,"Comedy, Drama, Romance","Young, rich, and obsessed with death, Harold finds himself changed forever when he meets lively septuagenarian Maude at a funeral.",Hal Ashby,Ruth Gordon,Bud Cort,Vivian Pickles,Cyril Cusack,harold maude comedy drama romance young rich obsessed death harold finds changed forever meets lively septuagenarian maude funeral hal ashby ruth gordon bud cort vivian pickles cyril cusack
542,Patton,"Biography, Drama, War",The World War II phase of the career of controversial American general George S. Patton.,Franklin J. Schaffner,George C. Scott,Karl Malden,Stephen Young,Michael Strong,patton biography drama war world war ii phase career controversial american general george patton franklin j schaffner george c scott karl malden stephen young michael strong
543,The Wild Bunch,"Action, Adventure, Western","An aging group of outlaws look for one last big score as the ""traditional"" American West is disappearing around them.",Sam Peckinpah,William Holden,Ernest Borgnine,Robert Ryan,Edmond O'Brien,wild bunch action adventure western aging group outlaws look one last big score traditional american west disappearing around sam peckinpah william holden ernest borgnine robert ryan edmond brien
544,Night of the Living Dead,"Horror, Thriller",A ragtag group of Pennsylvanians barricade themselves in an old farmhouse to remain safe from a horde of flesh-eating ghouls that are ravaging the East Coast of the United States.,George A. Romero,Duane Jones,Judith O'Dea,Karl Hardman,Marilyn Eastman,night living dead horror thriller ragtag group pennsylvanians barricade old farmhouse remain safe horde flesh eating ghouls ravaging east coast united states george romero duane jones judith dea karl hardman marilyn eastman
545,The Lion in Winter,"Biography, Drama, History","1183 A.D.: King Henry II's three sons all want to inherit the throne, but he won't commit to a choice. They and his wife variously plot to force him.",Anthony Harvey,Peter O'Toole,Katharine Hepburn,Anthony Hopkins,John Castle,lion winter biography drama history 1183 king henry ii three sons want inherit throne commit choice wife variously plot force anthony harvey peter toole katharine hepburn anthony hopkins john castle
