,Series_Title,Genre,Overview,Director,Star1,Star2,Star3,Star4,combined_cols
216,Rush,"Action, Biography, Drama",The merciless 1970s rivalry between Formula One rivals James Hunt and Niki Lauda.,Ron Howard,Daniel Brühl,Chris Hemsworth,Olivia Wilde,Alexandra Maria Lara,rush action biography drama merciless 1970s rivalry formula one rivals james hunt niki lauda ron howard daniel br hl chris hemsworth olivia wilde alexandra maria lara
217,Ford v Ferrari,"Action, Biography, Drama",American car designer Carroll Shelby and driver Ken Miles battle corporate interference and the laws of physics to build a revolutionary race car for Ford in order to defeat Ferrari at the 24 Hours of Le Mans in 1966.,James Mangold,Matt Damon,Christian Bale,Jon Bernthal,Caitriona Balfe,ford v ferrari action biography drama american car designer carroll shelby driver ken miles battle corporate interference laws physics build revolutionary race car ford order defeat ferrari 24 hours le mans 1966 james mangold matt damon christian bale jon bernthal caitriona balfe
218,Spotlight,"Biography, Crime, Drama","The true story of how the Boston Globe uncovered the massive scandal of child molestation and cover-up within the local Catholic Archdiocese, shaking the entire Catholic Church to its core.",Tom McCarthy,Mark Ruffalo,Michael Keaton,Rachel McAdams,Liev Schreiber,spotlight biography crime drama true story boston globe uncovered massive scandal child molestation cover within local catholic archdiocese shaking entire catholic church core tom mccarthy mark ruffalo michael keaton rachel mcadams liev schreiber
219,Song of the Sea,"Animation, Adventure, Drama","Ben, a young Irish boy, and his little sister Saoirse, a girl who can turn into a seal, go on an adventure to free the fairies and save the spirit world.",Tomm Moore,David Rawle,Brendan Gleeson,Lisa Hannigan,Fionnula Flanagan,song sea animation adventure drama ben young irish boy little sister saoirse girl turn seal go adventure free fairies save spirit world tomm moore david rawle brendan gleeson lisa hannigan fionnula flanagan
220,Kahaani,"Mystery, Thriller","A pregnant woman's search for her missing husband takes her from London to Kolkata, but everyone she questions denies having ever met him.",Sujoy Ghosh,Vidya Balan,Parambrata Chattopadhyay,Indraneil Sengupta,Nawazuddin Siddiqui,kahaani mystery thriller pregnant woman search missing husband takes london kolkata everyone questions denies ever met sujoy ghosh vidya balan parambrata chattopadhyay indraneil sengupta nawazuddin siddiqui
221,Zindagi Na Milegi Dobara,"Comedy, Drama",Three friends decide to turn their fantasy vacation into reality after one of their friends gets engaged.,Zoya Akhtar,Hrithik Roshan,Farhan Akhtar,Abhay Deol,Katrina Kaif,zindagi na milegi dobara comedy drama three friends decide turn fantasy vacation reality one friends gets engaged zoya akhtar hrithik roshan farhan akhtar abhay deol katrina kaif
222,Prisoners,"Crime, Drama, Mystery","When Keller Dover's daughter and her friend go missing, he takes matters into his own hands as the police pursue multiple leads and the pressure mounts.",Denis Villeneuve,Hugh Jackman,Jake Gyllenhaal,Viola Davis,Melissa Leo,prisoners crime drama mystery keller dover daughter friend go missing takes matters hands police pursue multiple leads pressure mounts denis villeneuve hugh jackman jake gyllenhaal viola davis melissa leo
223,Mad Max: Fury Road,"Action, Adventure, Sci-Fi","In a post-apocalyptic wasteland, a woman rebels against a tyrannical ruler in search for her homeland with the aid of a group of female prisoners, a psychotic worshiper, and a drifter named Max.",George Miller,Tom Hardy,Charlize Theron,Nicholas Hoult,Zoë Kravitz,mad max fury road action adventure sci fi post apocalyptic wasteland woman rebels tyrannical ruler search homeland aid group female prisoners psychotic worshiper drifter named max george miller tom hardy charlize theron nicholas hoult zo kravitz
224,A Wednesday,"Action, Crime, Drama",A retiring police officer reminisces about the most astounding day of his career. About a case that was never filed but continues to haunt him in his memories - the case of a man and a Wednesday.,Neeraj Pandey,Anupam Kher,Naseeruddin Shah,Jimmy Sheirgill,Aamir Bashir,wednesday action crime drama retiring police officer reminisces astounding day career case never filed continues haunt memories case man wednesday neeraj pandey anupam kher naseeruddin shah jimmy sheirgill aamir bashir
225,Gran Torino,Drama,"Disgruntled Korean War veteran Walt Kowalski sets out to reform his neighbor, Thao Lor, a Hmong teenager who tried to steal Kowalski's prized possession: a 1972 Gran Torino.",Clint Eastwood,Clint Eastwood,Bee Vang,Christopher Carley,Ahney Her,gran torino drama disgruntled korean war veteran walt kowalski sets reform neighbor thao lor hmong teenager tried steal kowalski prized possession 1972 gran torino clint eastwood clint eastwood bee vang christopher carley ahney
226,Harry Potter and the Deathly Hallows: Part 2,"Adventure, Drama, Fantasy","Harry, Ron, and Hermione search for Voldemort's remaining Horcruxes in their effort to destroy the Dark Lord as the final battle rages on at Hogwarts.",David Yates,Daniel Radcliffe,Emma Watson,Rupert Grint,Michael Gambon,harry potter deathly hallows part 2 adventure drama fantasy harry ron hermione search voldemort remaining horcruxes effort destroy dark lord final battle rages hogwarts david yates daniel radcliffe emma watson rupert grint michael gambon
227,Okuribito,"Drama, Music",A newly unemployed cellist takes a job preparing the dead for funerals.,Yôjirô Takita,Masahiro Motoki,Ryôko Hirosue,Tsutomu Yamazaki,Kazuko Yoshiyuki,okuribito drama music newly unemployed cellist takes job preparing dead funerals jir takita masahiro motoki ry ko hirosue tsutomu yamazaki kazuko yoshiyuki
228,Hachi: A Dog's Tale,"Biography, Drama, Family",A college professor bonds with an abandoned dog he takes into his home.,Lasse Hallström,Richard Gere,Joan Allen,Cary-Hiroyuki Tagawa,Sarah Roemer,hachi dog tale biography drama family college professor bonds abandoned dog takes home lasse hallstr richard gere joan allen cary hiroyuki tagawa sarah roemer
229,Mary and Max,"Animation, Comedy, Drama","A tale of friendship between two unlikely pen pals: Mary, a lonely, eight-year-old girl living in the suburbs of Melbourne, and Max, a forty-four-year old, severely obese man living in New York.",Adam Elliot,Toni Collette,Philip Seymour Hoffman,Eric Bana,Barry Humphries,mary max animation comedy drama tale friendship two unlikely pen pals mary lonely eight year old girl living suburbs melbourne max forty four year old severely obese man living new york adam elliot toni collette philip seymour hoffman eric bana barry humphries
230,How to Train Your Dragon,"Animation, Action, Adventure","A hapless young Viking who aspires to hunt dragons becomes the unlikely friend of a young dragon himself, and learns there may be more to the creatures than he assumed.",Dean DeBlois,Chris Sanders,Jay Baruchel,Gerard Butler,Christopher Mintz-Plasse,train dragon animation action adventure hapless young viking aspires hunt dragons becomes unlikely friend young dragon learns may creatures assumed dean deblois chris sanders jay baruchel gerard butler christopher mintz plasse
231,Into the Wild,"Adventure, Biography, Drama","After graduating from Emory University, top student and athlete Christopher McCandless abandons his possessions, gives his entire $24,000 savings account to charity and hitchhikes to Alaska to live in the wilderness. Along the way, Christopher encounters a series of characters that shape his life.",Sean Penn,Emile Hirsch,Vince Vaughn,Catherine Keener,Marcia Gay Harden,wild adventure biography drama graduating emory university top student athlete christopher mccandless abandons possessions gives entire 24 000 savings account charity hitchhikes alaska live wilderness along way christopher encounters series characters shape life sean penn emile hirsch vince vaughn catherine keener marcia gay harden
232,No Country for Old Men,"Crime, Drama, Thriller",Violence and mayhem ensue after a hunter stumbles upon a drug deal gone wrong and more than two million dollars in cash near the Rio Grande.,Ethan Coen,Joel Coen,Tommy Lee Jones,Javier Bardem,Josh Brolin,country old men crime drama thriller violence mayhem ensue hunter stumbles upon drug deal gone wrong two million dollars cash near rio grande ethan coen joel coen tommy lee jones javier bardem josh brolin
233,Lage Raho Munna Bhai,"Comedy, Drama, Romance",Munna Bhai embarks on a journey with Mahatma Gandhi in order to fight against a corrupt property dealer.,Rajkumar Hirani,Sanjay Dutt,Arshad Warsi,Vidya Balan,Boman Irani,lage raho munna bhai comedy drama romance munna bhai embarks journey mahatma gandhi order fight corrupt property dealer rajkumar hirani sanjay dutt arshad warsi vidya balan boman irani
234,Million Dollar Baby,"Drama, Sport",A determined woman works with a hardened boxing trainer to become a professional.,Clint Eastwood,Hilary Swank,Clint Eastwood,Morgan Freeman,Jay Baruchel,million dollar baby drama sport determined woman works hardened boxing trainer become professional clint eastwood hilary swank clint eastwood morgan freeman jay baruchel
235,Hotel Rwanda,"Biography, Drama, History","Paul Rusesabagina, a hotel manager, houses over a thousand Tutsi refugees during their struggle against the Hutu militia in Rwanda, Africa.",Terry George,Don Cheadle,Sophie Okonedo,Joaquin Phoenix,Xolani Mali,hotel rwanda biography drama history paul rusesabagina hotel manager houses thousand tutsi refugees struggle hutu militia rwanda africa terry george cheadle sophie okonedo joaquin phoenix xolani mali
236,Taegukgi hwinalrimyeo,"Action, Drama, War","When two brothers are forced to fight in the Korean War, the elder decides to take the riskiest missions if it will help shield the younger from battle.",Je-kyu Kang,Jang Dong-Gun,Won Bin,Eun-ju Lee,Hyeong-jin Kong,taegukgi hwinalrimyeo action drama war two brothers forced fight korean war elder decides take riskiest missions help shield younger battle je kyu kang jang dong gun bin eun ju lee hyeong jin kong
237,Before Sunset,"Drama, Romance","Nine years after Jesse and Celine first met, they encounter each other again on the French leg of Jesse's book tour.",Richard Linklater,Ethan Hawke,Julie Delpy,Vernon Dobtcheff,Louise Lemoine Torrès,sunset drama romance nine years jesse celine first met encounter french leg jesse book tour richard linklater ethan hawke julie delpy vernon dobtcheff louise lemoine torr
238,Munna Bhai M.B.B.S.,"Comedy, Drama, Musical",A gangster sets out to fulfill his father's dream of becoming a doctor.,Rajkumar Hirani,Sanjay Dutt,Arshad Warsi,Gracy Singh,Sunil Dutt,munna bhai b b comedy drama musical gangster sets fulfill father dream becoming doctor rajkumar hirani sanjay dutt arshad warsi gracy singh sunil dutt
239,Salinui chueok,"Crime, Drama, Mystery","In a small Korean province in 1986, two detectives struggle with the case of multiple young women being found raped and murdered by an unknown culprit.",Bong Joon Ho,Kang-ho Song,Kim Sang-kyung,Roe-ha Kim,Jae-ho Song,salinui chueok crime drama mystery small korean province 1986 two detectives struggle case multiple young women found raped murdered unknown culprit bong joon ho kang ho song kim sang kyung roe ha kim jae ho song
240,Dil Chahta Hai,"Comedy, Drama, Romance","Three inseparable childhood friends are just out of college. Nothing comes between them - until they each fall in love, and their wildly different approaches to relationships creates tension.",Farhan Akhtar,Aamir Khan,Saif Ali Khan,Akshaye Khanna,Preity Zinta,dil chahta hai comedy drama romance three inseparable childhood friends college nothing comes fall love wildly different approaches relationships creates tension farhan akhtar aamir khan saif ali khan akshaye khanna preity zinta
241,Kill Bill: Vol. 1,"Action, Crime, Drama","After awakening from a four-year coma, a former assassin wreaks vengeance on the team of assassins who betrayed her.",Quentin Tarantino,Uma Thurman,David Carradine,Daryl Hannah,Michael Madsen,kill bill vol 1 action crime drama awakening four year coma former assassin wreaks vengeance team assassins betrayed quentin tarantino uma thurman david carradine daryl hannah michael madsen
242,Finding Nemo,"Animation, Adventure, Comedy","After his son is captured in the Great Barrier Reef and taken to Sydney, a timid clownfish sets out on a journey to bring him home.",Andrew Stanton,Lee Unkrich,Albert Brooks,Ellen DeGeneres,Alexander Gould,finding nemo animation adventure comedy son captured great barrier reef taken sydney timid clownfish sets journey bring home andrew stanton lee unkrich albert brooks ellen degeneres alexander gould
243,Catch Me If You Can,"Biography, Crime, Drama","Barely 21 yet, Frank is a skilled forger who has passed as a doctor, lawyer and pilot. FBI agent Carl becomes obsessed with tracking down the con man, who only revels in the pursuit.",Steven Spielberg,Leonardo DiCaprio,Tom Hanks,Christopher Walken,Martin Sheen,catch biography crime drama barely 21 yet frank skilled forger passed doctor lawyer pilot fbi agent carl becomes obsessed tracking con man revels pursuit steven spielberg leonardo dicaprio tom hanks christopher walken martin sheen
244,Amores perros,"Drama, Thriller","A horrific car accident connects three stories, each involving characters dealing with loss, regret, and life's harsh realities, all in the name of love.",Alejandro G. Iñárritu,Emilio Echevarría,Gael García Bernal,Goya Toledo,Álvaro Guerrero,amores perros drama thriller horrific car accident connects three stories involving characters dealing loss regret life harsh realities name love alejandro g rritu emilio echevarr gael garc bernal goya toledo lvaro guerrero
245,"Monsters, Inc.","Animation, Adventure, Comedy","In order to power the city, monsters have to scare children so that they scream. However, the children are toxic to the monsters, and after a child gets through, 2 monsters realize things may not be what they think.",Pete Docter,David Silverman,Lee Unkrich,Billy Crystal,John Goodman,monsters inc animation adventure comedy order power city monsters scare children scream however children toxic monsters child gets 2 monsters realize things may think pete docter david silverman lee unkrich billy crystal john goodman
246,"Shin seiki Evangelion Gekijô-ban: Air/Magokoro wo, kimi ni","Animation, Action, Drama",Concurrent theatrical ending of the TV series Shin seiki evangerion (1995).,Hideaki Anno,Kazuya Tsurumaki,Megumi Ogata,Megumi Hayashibara,Yûko Miyamura,shin seiki evangelion gekij ban air magokoro wo kimi ni animation action drama concurrent theatrical ending tv series shin seiki evangerion 1995 hideaki anno kazuya tsurumaki megumi ogata megumi hayashibara ko miyamura
247,Lagaan: Once Upon a Time in India,"Adventure, Drama, Musical",The people of a small village in Victorian India stake their future on a game of cricket against their ruthless British rulers.,Ashutosh Gowariker,Aamir Khan,Raghuvir Yadav,Gracy Singh,Rachel Shelley,lagaan upon time india adventure drama musical people small village victorian india stake future game cricket ruthless british rulers ashutosh gowariker aamir khan raghuvir yadav gracy singh rachel shelley
248,The Sixth Sense,"Drama, Mystery, Thriller",A boy who communicates with spirits seeks the help of a disheartened child psychologist.,M. Night Shyamalan,Bruce Willis,Haley Joel Osment,Toni Collette,Olivia Williams,sixth sense drama mystery thriller boy communicates spirits seeks help disheartened child psychologist night shyamalan bruce willis haley joel osment toni collette olivia williams
249,La leggenda del pianista sull'oceano,"Drama, Music, Romance","A baby boy, discovered in 1900 on an ocean liner, grows into a musical prodigy, never setting foot on land.",Giuseppe Tornatore,Tim Roth,Pruitt Taylor Vince,Mélanie Thierry,Bill Nunn,la leggenda del pianista sull oceano drama music romance baby boy discovered 1900 ocean liner grows musical prodigy never setting foot land giuseppe tornatore tim roth pruitt taylor vince lanie thierry bill nunn
250,The Truman Show,"Comedy, Drama",An insurance salesman discovers his whole life is actually a reality TV show.,Peter Weir,Jim Carrey,Ed Harris,Laura Linney,Noah Emmerich,truman show comedy drama insurance salesman discovers whole life actually reality tv show peter weir jim carrey ed harris laura linney noah emmerich
251,"Crna macka, beli macor","Comedy, Crime, Romance",Matko and his son Zare live on the banks of the Danube river and get by through hustling and basically doing anything to make a living. In order to pay off a business debt Matko agrees to marry off Zare to the sister of a local gangster.,Emir Kusturica,Bajram Severdzan,Srdjan 'Zika' Todorovic,Branka Katic,Florijan Ajdini,crna macka beli macor comedy crime romance matko son zare live banks danube river get hustling basically anything make living order pay business debt matko agrees marry zare sister local gangster emir kusturica bajram severdzan srdjan zika todorovic branka katic florijan ajdini
252,The Big Lebowski,"Comedy, Crime, Sport","Jeff ""The Dude"" Lebowski, mistaken for a millionaire of the same name, seeks restitution for his ruined rug and enlists his bowling buddies to help get it.",Joel Coen,Ethan Coen,Jeff Bridges,John Goodman,Julianne Moore,big lebowski comedy crime sport jeff dude lebowski mistaken millionaire name seeks restitution ruined rug enlists bowling buddies help get joel coen ethan coen jeff bridges john goodman julianne moore
253,Fa yeung nin wah,"Drama, Romance","Two neighbors, a woman and a man, form a strong bond after both suspect extramarital activities of their spouses. However, they agree to keep their bond platonic so as not to commit similar wrongs.",Kar-Wai Wong,Tony Chiu-Wai Leung,Maggie Cheung,Ping Lam Siu,Tung Cho 'Joe' Cheung,fa yeung nin wah drama romance two neighbors woman man form strong bond suspect extramarital activities spouses however agree keep bond platonic commit similar wrongs kar wai wong tony chiu wai leung maggie cheung ping lam siu tung cho joe cheung
254,Trainspotting,Drama,"Renton, deeply immersed in the Edinburgh drug scene, tries to clean up and get out, despite the allure of the drugs and influence of friends.",Danny Boyle,Ewan McGregor,Ewen Bremner,Jonny Lee Miller,Kevin McKidd,trainspotting drama renton deeply immersed edinburgh drug scene tries clean get despite allure drugs influence friends danny boyle ewan mcgregor ewen bremner jonny lee miller kevin mckidd
255,Fargo,"Crime, Drama, Thriller",Jerry Lundegaard's inept crime falls apart due to his and his henchmen's bungling and the persistent police work of the quite pregnant Marge Gunderson.,Joel Coen,Ethan Coen,William H. Macy,Frances McDormand,Steve Buscemi,fargo crime drama thriller jerry lundegaard inept crime falls apart due henchmen bungling persistent police work quite pregnant marge gunderson joel coen ethan coen william h macy frances mcdormand steve buscemi
256,Underground,"Comedy, Drama, War","A group of Serbian socialists prepares for the war in a surreal underground filled by parties, tragedies, love and hate.",Emir Kusturica,Predrag 'Miki' Manojlovic,Lazar Ristovski,Mirjana Jokovic,Slavko Stimac,underground comedy drama war group serbian socialists prepares war surreal underground filled parties tragedies love hate emir kusturica predrag miki manojlovic lazar ristovski mirjana jokovic slavko stimac
257,La haine,"Crime, Drama",24 hours in the lives of three young men in the French suburbs the day after a violent riot.,Mathieu Kassovitz,Vincent Cassel,Hubert Koundé,Saïd Taghmaoui,Abdel Ahmed Ghili,la haine crime drama 24 hours lives three young men french suburbs day violent riot mathieu kassovitz vincent cassel hubert kound sa taghmaoui abdel ahmed ghili
258,Dilwale Dulhania Le Jayenge,"Drama, Romance","When Raj meets Simran in Europe, it isn't love at first sight but when Simran moves to India for an arranged marriage, love makes its presence felt.",Aditya Chopra,Shah Rukh Khan,Kajol,Amrish Puri,Farida Jalal,dilwale dulhania le jayenge drama romance raj meets simran europe love first sight simran moves india arranged marriage love makes presence felt aditya chopra shah rukh khan kajol amrish puri farida jalal
259,Before Sunrise,"Drama, Romance","A young man and woman meet on a train in Europe, and wind up spending one evening together in Vienna. Unfortunately, both know that this will probably be their only night together.",Richard Linklater,Ethan Hawke,Julie Delpy,Andrea Eckert,Hanno Pöschl,sunrise drama romance young man woman meet train europe wind spending one evening together vienna unfortunately know probably night together richard linklater ethan hawke julie delpy andrea eckert hanno p schl
260,Trois couleurs: Rouge,"Drama, Mystery, Romance",A model discovers a retired judge is keen on invading people's privacy.,Krzysztof Kieslowski,Irène Jacob,Jean-Louis Trintignant,Frédérique Feder,Jean-Pierre Lorit,trois couleurs rouge drama mystery romance model discovers retired judge keen invading people privacy krzysztof kieslowski ir ne jacob jean louis trintignant fr rique feder jean pierre lorit
261,Chung Hing sam lam,"Comedy, Crime, Drama","Two melancholy Hong Kong policemen fall in love: one with a mysterious female underworld figure, the other with a beautiful and ethereal server at a late-night restaurant he frequents.",Kar-Wai Wong,Brigitte Lin,Takeshi Kaneshiro,Tony Chiu-Wai Leung,Faye Wong,chung hing sam lam comedy crime drama two melancholy hong kong policemen fall love one mysterious female underworld figure beautiful ethereal server late night restaurant frequents kar wai wong brigitte lin takeshi kaneshiro tony chiu wai leung faye wong
262,Jurassic Park,"Action, Adventure, Sci-Fi",A pragmatic paleontologist visiting an almost complete theme park is tasked with protecting a couple of kids after a power failure causes the park's cloned dinosaurs to run loose.,Steven Spielberg,Sam Neill,Laura Dern,Jeff Goldblum,Richard Attenborough,jurassic park action adventure sci fi pragmatic paleontologist visiting almost complete theme park tasked protecting couple kids power failure causes park cloned dinosaurs run loose steven spielberg sam neill laura dern jeff goldblum richard attenborough
263,In the Name of the Father,"Biography, Crime, Drama",A man's coerced confession to an I.R.A. bombing he did not commit results in the imprisonment of his father as well. An English lawyer fights to free them.,Jim Sheridan,Daniel Day-Lewis,Pete Postlethwaite,Alison Crosbie,Philip King,name father biography crime drama man coerced confession r bombing commit results imprisonment father well english lawyer fights free jim sheridan daniel day lewis pete postlethwaite alison crosbie philip king
264,Ba wang bie ji,"Drama, Music, Romance",Two boys meet at an opera training school in Peking in 1924. Their resulting friendship will span nearly 70 years and will endure some of the most troublesome times in China's history.,Kaige Chen,Leslie Cheung,Fengyi Zhang,Gong Li,You Ge,ba wang bie ji drama music romance two boys meet opera training school peking 1924 resulting friendship span nearly 70 years endure troublesome times china history kaige chen leslie cheung fengyi zhang gong li ge
265,Dà hóng denglong gaogao guà,"Drama, History, Romance","A young woman becomes the fourth wife of a wealthy lord, and must learn to live with the strict rules and tensions within the household.",Yimou Zhang,Gong Li,Jingwu Ma,Saifei He,Cuifen Cao,h ng denglong gaogao gu drama history romance young woman becomes fourth wife wealthy lord must learn live strict rules tensions within household yimou zhang gong li jingwu saifei cuifen cao
266,Dead Poets Society,"Comedy, Drama",Maverick teacher John Keating uses poetry to embolden his boarding school students to new heights of self-expression.,Peter Weir,Robin Williams,Robert Sean Leonard,Ethan Hawke,Josh Charles,dead poets society comedy drama maverick teacher john keating uses poetry embolden boarding school students new heights self expression peter weir robin williams robert sean leonard ethan hawke josh charles
267,Stand by Me,"Adventure, Drama","After the death of one of his friends, a writer recounts a childhood journey with his friends to find the body of a missing boy.",Rob Reiner,Wil Wheaton,River Phoenix,Corey Feldman,Jerry O'Connell,stand adventure drama death one friends writer recounts childhood journey friends find body missing boy rob reiner wil wheaton river phoenix corey feldman jerry connell
268,Platoon,"Drama, War","Chris Taylor, a neophyte recruit in Vietnam, finds himself caught in a battle of wills between two sergeants, one good and the other evil. A shrewd examination of the brutality of war and the duality of man in conflict.",Oliver Stone,Charlie Sheen,Tom Berenger,Willem Dafoe,Keith David,platoon drama war chris taylor neophyte recruit vietnam finds caught battle wills two sergeants one good evil shrewd examination brutality war duality man conflict oliver stone charlie sheen tom berenger willem dafoe keith david
269,"Paris, Texas",Drama,"Travis Henderson, an aimless drifter who has been missing for four years, wanders out of the desert and must reconnect with society, himself, his life, and his family.",Wim Wenders,Harry Dean Stanton,Nastassja Kinski,Dean Stockwell,Aurore Clément,paris texas drama travis henderson aimless drifter missing four years wanders desert must reconnect society life family wim wenders harry dean stanton nastassja kinski dean stockwell aurore cl ment
